asset_id,path,category,creator_or_source,creation_method,modifications,license_basis,public_use_status,sha256
magical-girl-master-prompt,art/prompts/magical-girl-master.md,prompt,Codex from approved project design,structured original generation specification,normalized constraints and chroma-key production notes,original project-authored prompt with no third-party asset,approved,a04e6c2ec9c29ad48fdfaccecf11a97b7e46a1245e0dbf9df3f5e887b117ca78
magical-girl-concept-v01,art/source/magical-girl/concept-v01.png,source-image,OpenAI Image 2 via Codex,full-character generation using private reference only for abstract proportion and mood,none; preserved as the first complete candidate,original generated work created for this project,approved,d66f816ce5a9a6b16e740bc49cd51a34347a6107726b9b5855187d2ee8982702
magical-girl-approved-master,art/source/magical-girl/approved-master.png,source-image,OpenAI Image 2 via Codex,complete-character generation followed by same-character proportion correction,chroma-key removal; green despill; transparent edge cleanup; high-quality resize to 4096 px,original generated and modified work created for this project,approved,de9a5af6215c2c5d2ba22df86cf583fda8bfd907939cbc84a1087d1cd931a205
magical-girl-approved-master-ora,art/source/magical-girl/approved-master.ora,editable-source,Codex,OpenRaster package assembled from approved master,embedded merged preview; thumbnail; named approved layer,derived only from the approved original project artwork,approved,00058fe2cceadc6510744e914f0d84ea5eebc677c0a5174886b9a3b25c2e14d3
magical-girl-master-contact-sheet,art/reviews/magical-girl-master-contact-sheet.png,review-image,Codex,review composite generated from approved master,full view; four detail crops; black white and deep-purple edge checks,derived only from the approved original project artwork,approved,2bfeb824b54b74ef8ebe57c9f0bacfe73b24134a401464b0cf557b5ef246d7a9
